product_token,name,category,sales_count,order_count,visit_count,date
p_ujs2rxbwwy,Charcoal Heather Gray Active Long Sleeve Crew Neck,T-Shirts,0,0,0,2023-11-01
p_tpzfdnukzs,Navy Active Long Sleeve Crew Neck,Sweatshirt,0,0,0,2023-11-01
p_5q6tnqwruf,Heather Light Gray Active Long Sleeve Crew Neck,Sweatshirt,0,0,0,2023-11-01
p_r5gttk27sm,White Active Long Sleeve Crew Neck,Shirt,0,0,0,2023-11-01
p_5kpddtqty2,Heather Navy Active Long Sleeve Crew Neck,Sweatshirt,0,0,0,2023-11-01
p_svsvrfrcb6,Black Active Long Sleeve Crew Neck T-Shirt,T-Shirts,0,0,0,2023-11-01
p_bdybxrzhhw,Heather Gray Fleece French Terry Pullover Hoodie,Hoodie,0,0,0,2023-11-01
p_3wz546brng,Military Green Fleece French Terry Pullover Hoodie,Hoodie,0,0,0,2023-11-01
p_dup4ggmu3h,Carbon Fleece French Terry Pullover Hoodie,Hoodie,0,0,0,2023-11-01
p_k6s6hftqfe,Navy Fleece French Terry Pullover Hoodie,Hoodie,0,0,0,2023-11-01
p_26twzeayzk,Black Fleece French Terry Pullover Hoodie,Hoodie,0,0,0,2023-11-01
p_cz4mtzemgt,Heather Gray Fleece French Terry Zip Hoodie,Hoodie,0,0,0,2023-11-01
p_8q6kvd32nc,Military Green Fleece French Terry Zip Hoodie,Hoodie,0,0,0,2023-11-01
p_szpx92nwke,Carbon Fleece French Terry Zip Hoodie,Hoodie,0,0,0,2023-11-01
p_h9z43a8zde,Navy Fleece French Terry Zip Hoodie,Hoodie,0,0,0,2023-11-01
p_xnzebcgf9j,Black Fleece French Terry Zip Hoodie,Hoodie,0,0,0,2023-11-01
p_kajnxmygka,Heather Military Green Crew Neck T-Shirt,Shirt,0,0,0,2023-11-01
p_hmkhv4g497,Heather Indigo Crew Neck T-Shirt,Shirt,0,0,0,2023-11-01
p_ug6duq4hvt,Heather Navy Crew Neck T-Shirt,Shirt,0,0,0,2023-11-01
p_6mjy2uxzxz,Carbon Crew Neck Tee,Shirt,0,0,0,2023-11-01
p_tam5u7s5tg,Indigo Crew Neck T-Shirt,Shirt,0,0,0,2023-11-01
p_gbd3qsz25s,Heather Charcoal Gray Crew Neck T-Shirt,Shirt,0,0,0,2023-11-01
p_jyhaqugrqk,Heather Gray Crew Neck T-Shirt,Screen Printed T-Shirts,0,0,0,2023-11-01
p_aexgxsghfh,Military Green Crew Neck T-Shirt,Shirt,0,0,0,2023-11-01
p_sgr8mhab7h,Navy Crew Neck T-Shirt,Shirt,0,0,0,2023-11-01
p_p6zw3xeg4v,Black Crew Neck T-Shirt,Shirt,0,0,0,2023-11-01
p_zkt8hky46f,White Crew Neck T-Shirt,Shirt,0,0,0,2023-11-01
p_td93w3rbmy,Heather Gray Tall Straight Hem Crew Neck T-Shirt,T-Shirts,0,0,0,2023-11-01
p_zm7a3rkwma,Navy Tall Straight Hem Crew Neck T-Shirt,Shirt,0,0,0,2023-11-01
p_rezzg23bjy,Navy Fleece French Terry Pullover Crew Neck Sweatshirt,Sweatshirt,0,0,0,2023-11-01
p_8jmz33scf8,Black Fleece French Terry Pullover Crew Neck Sweatshirt,Sweatshirt,0,0,0,2023-11-01
p_afb4v7598s,Carbon Fleece French Terry Pullover Crew Neck Sweatshirt,Sweatshirt,0,0,0,2023-11-01
p_shcbhfeqaq,Military Green Fleece French Terry Pullover Crew Neck Sweatshirt,Sweatshirt,0,0,0,2023-11-01
p_wasnbdgtfb,Heather Gray Fleece French Terry Pullover Crew Neck Sweatshirt,Sweatshirt,0,0,0,2023-11-01
p_xhhgk2nnba,Heather Burgundy Crew Neck T-Shirt,Shirt,0,0,0,2023-11-01
p_7ekanr458k,Heather Burgundy Active Crew Neck T-Shirt,Shirt,0,0,0,2023-11-01
p_8d5cs572ku,Evergreen Heather Crew Neck T-Shirt,Shirt,0,0,0,2023-11-01
p_hc97kv4jxf,Deep Sea Blue Crew Neck T-Shirt,Shirt,0,0,0,2023-11-01
p_59st4ejx9g,Heather Graphite Short Sleeve Crew Neck T-Shirt,Shirt,0,0,0,2023-11-01
p_szf6pmhzds,Heather Sapphire Short Sleeve Crew Neck T-Shirt,Screen Printed T-Shirts,0,0,0,2023-11-01
p_yxq99tj7cv,Heather Slate Green Short Sleeve Crew Neck T-Shirt,Shirt,0,0,0,2023-11-01
p_sdnkz293xh,Heather Mist Short Sleeve Crew Neck T-Shirt,Shirt,0,0,0,2023-11-01
p_2dks743yby,Steel Short Sleeve Crew Neck T-Shirt,T-Shirts,0,0,0,2023-11-01
p_4xe3gpdex5,Heather Voyager Short Sleeve Crew Neck T-Shirt,Shirt,0,0,0,2023-11-01
p_pzx9wvv4qb,Heather Mauve Short Sleeve Crew Neck T-Shirt,Shirt,0,0,0,2023-11-01
p_ne28r8hbv2,Heather Seafarer Short Sleeve Crew Neck T-Shirt,T-Shirts,0,0,0,2023-11-01
p_rrybhw4akq,Sapphire Short Sleeve Crew Neck T-Shirt,Shirt,0,0,0,2023-11-01
p_guzmuvmxwg,Heather Dark Orchid Short Sleeve Crew Neck T-Shirt,Shirt,0,0,0,2023-11-01
p_wvdzacyaq8,Heather Garnet Short Sleeve Crew Neck T-Shirt,Shirt,0,0,0,2023-11-01
p_r6f5ekuzmt,Mahogany V-Neck T-Shirt,Shirt,0,0,0,2023-11-01
p_hfkg6sn6kx,Heather Dark Oak V-Neck T-Shirt,Shirt,0,0,0,2023-11-01
p_uqg73gd526,Dark Olive V-Neck T-Shirt,Shirt,0,0,0,2023-11-01
p_x53atty9z2,Steel Short Sleeve Vee Neck T-Shirt,Shirt,0,0,0,2023-11-01
p_qktubda8xw,Heather Sapphire Short Sleeve Vee Neck T-Shirt,Shirt,0,0,0,2023-11-01
p_wbmd5aq6pe,Heather Dark Orchid Short Sleeve Vee Neck T-Shirt,Shirt,0,0,0,2023-11-01
p_tbnsv2v9nn,Heather Mist Short Sleeve Vee Neck T-Shirt,Shirt,0,0,0,2023-11-01
p_e9w8d86bdc,Heather Seafarer Short Sleeve Vee Neck T-Shirt,Shirt,0,0,0,2023-11-01
p_3v4yky7tvb,Heather Voyager Short Sleeve Vee Neck T-Shirt,Shirt,0,0,0,2023-11-01
p_fqsqmarq3k,Mahogany Long Sleeve T-Shirt,Shirt,0,0,0,2023-11-01
p_wtfwp7uyps,Heather Dark Oak Long Sleeve T-Shirt,Shirt,0,0,0,2023-11-01
p_yw7vvn467f,Dark Olive Long Sleeve T-Shirt,Shirt,0,0,0,2023-11-01
p_2qn4rb76qt,Evergreen Heather Long Sleeve T-Shirt,Shirt,0,0,0,2023-11-01
p_zp4vn3rtz4,Deep Sea Blue Long Sleeve T-Shirt,Shirt,0,0,0,2023-11-01
p_kyxg9qv34q,Black Slippers,Slippers,0,0,0,2023-11-01
p_tcyc3bpr7k,Reversible Casual Belt,Belt,0,0,0,2023-11-01
p_35bcpg5nfm,Reversible Dress Belt,Belt,0,0,0,2023-11-01
p_7dyz93zegj,"7"" Sapphire Active Training Short",Athletic Shorts,0,0,0,2023-11-01
p_3pkg63ym5k,"7"" Steel Active Training Short",Shorts,0,0,0,2023-11-01
p_k5hymg84ez,"Black 7"" 2-in-1 Training Short",Athletic Shorts,0,0,0,2023-11-01
p_vmg2cqe4bx,"Carbon 7"" 2-in-1 Training Short",Athletic Shorts,0,0,0,2023-11-01
p_vjj8djm98g,"Voyager 7"" 2-in-1 Training Short",Athletic Shorts,0,0,0,2023-11-01
p_encznv79zd,Charcoal Heather Gray Loungewear Jogger,Sweatpants & Joggers,0,0,0,2023-11-01
p_v42aqcrgdp,Heather Navy Loungewear Pant,Pants,0,0,0,2023-11-01
p_9kzk22fvrv,Navy Commuter Pant,Pants,0,0,0,2023-11-01
p_tvdv27amhe,Heather Navy Active Comfort Straight Leg Pant,Sweatpants & Joggers,0,0,0,2023-11-01
p_jqxjnq8mc8,Charcoal Heather Active Comfort Straight Leg Pant,Sweatpants & Joggers,0,0,0,2023-11-01
p_ys335pw23m,Black Active Comfort Straight Leg Pant,Sweatpants & Joggers,0,0,0,2023-11-01
p_sdzxb6shks,Navy Fleece Shacket,Shirt Jackets,0,0,0,2023-11-01
p_mwba7xeera,Dark Olive Fleece Shacket,Jacket,0,0,0,2023-11-01
p_zzvxdda285,Black Fleece Shacket,Jacket,0,0,0,2023-11-01
p_u25kmysesj,Medium Gray Wash Straight Fit Comfort Jeans,Jeans,0,0,0,2023-11-01
p_2nsetu5mvd,Indigo Wash Straight Fit Comfort Jeans,Jeans,0,0,0,2023-11-01
p_bn49najk97,Gray Wash Straight Fit Comfort Jeans,Jeans,0,0,0,2023-11-01
p_mu7q5qx67m,Black Wash Straight Fit Comfort Jeans,Jeans,0,0,0,2023-11-01
p_qvscv7wqa7,Dark Oak Fleece French Terry Jogger,Sweatpants & Joggers,0,0,0,2023-11-01
p_cyyubbh7u4,Mahogany Fleece French Terry Jogger,Sweatpants & Joggers,0,0,0,2023-11-01
p_8mf4cqusgd,Charcoal Heather Gray Fleece French Terry Jogger,Sweatpants & Joggers,0,0,0,2023-11-01
p_84w66d79b8,Black Comfort Chino Pants,Pants,0,0,0,2023-11-01
p_psgzpvuzxz,Khaki Comfort Chino Pants,Pants,0,0,0,2023-11-01
p_wa72wwxsy8,Navy Comfort Chino Pants,Pants,0,0,0,2023-11-01
p_kv4qxkyavb,Carbon Comfort Chino Pants,Pants,0,0,0,2023-11-01
p_4tw7w4865y,Medium Gray Wash Slim Fit Comfort Jeans,Jeans,0,0,0,2023-11-01
p_vccgy9j2qt,Indigo Wash Slim Fit Comfort Jeans,Jeans,0,0,0,2023-11-01
p_hun6quaf8f,Gray Wash Slim Fit Comfort Jeans,Jeans,0,0,0,2023-11-01
p_aaa5u2senn,Black Wash Slim Fit Comfort Jeans,Jeans,0,0,0,2023-11-01
p_tdz6dj3k93,Charcoal Heather Gray Active Shell Jacket,Jacket,0,0,0,2023-11-01
p_2rhbv3znrg,Heather Navy Active Shell Jacket,Jacket,0,0,0,2023-11-01
p_ef9p26sqwv,Navy Coaches Jacket,Jacket,0,0,0,2023-11-01
p_dd7ynwa46b,Military Green Coaches Jacket,Jacket,0,0,0,2023-11-01
p_grr928y5wp,Khaki Coaches Jacket,Jacket,0,0,0,2023-11-01
p_ens5k22dee,Black Coaches Jacket,Jacket,0,0,0,2023-11-01
p_9attt36kqt,Black Blazer,Blazer,0,0,0,2023-11-01
p_z7kat66jsb,Black Puffer Vest,Outerwear Vests,0,0,0,2023-11-01
p_gdsuag4twj,Charcoal Heather Active Comfort Full Zip Hoodie,Hoodie,0,0,0,2023-11-01
p_p8xcyckfzs,Heather Navy Active Comfort Pullover Hoodie,Hoodie,0,0,0,2023-11-01
p_vqudnj9pak,Charcoal Heather Active Comfort Pullover Hoodie,Hoodie,0,0,0,2023-11-01
p_2uptnqrxy2,Black Active Comfort Pullover Hoodie,Hoodie,0,0,0,2023-11-01
p_vkp29t8hpk,Black Sleeveless Active Muscle Tee,Athletic Tops,0,0,0,2023-11-01
p_4krqrmhc8s,Charcoal Heather Gray Sleeveless Active Muscle Tee,Athletic Tops,0,0,0,2023-11-01
p_2mwcc7hpkx,Light Heather Gray Sleeveless Active Muscle Tee,Tank Top,0,0,0,2023-11-01
p_auux7guqn5,Heather Forest Sleeveless Active Muscle Tee,Athletic Tops,0,0,0,2023-11-01
p_m26nune3tt,Heather Cocoa Sleeveless Active Muscle Tee,Tank Top,0,0,0,2023-11-01
p_a66qgjtv8u,Heather Cadet Sleeveless Active Muscle Tee,Athletic Tops,0,0,0,2023-11-01
p_hzkzcd9ag9,Charcoal Heather Gray Long Sleeve Ripstop Commuter Shirt,Shirt,0,0,0,2023-11-01
p_4677ez5g8v,Heather Navy Long Sleeve Ripstop Commuter Shirt,Shirt,0,0,0,2023-11-01
p_yrp9cazs3k,Olive Long Sleeve Ripstop Commuter Shirt,Shirt,0,0,0,2023-11-01
p_p33efb9tym,Heather Gray Long Sleeve Lightweight Flannel Shirt,Button Down Shirts,0,0,0,2023-11-01
p_n25u96wp2m,Navy Long Sleeve Lightweight Flannel Shirt,Shirt,0,0,0,2023-11-01
p_zc74ftx9hy,Charcoal Heather Gray Pique Crew Sweater,Knit Sweaters,0,0,0,2023-11-01
p_r6x3j7u5uu,Heather Gray Pique Crew Sweater,Knit Sweaters,0,0,0,2023-11-01
p_unze8zvvqr,Heather Navy Pique Crew Sweater,Knit Sweaters,0,0,0,2023-11-01
p_76w9v5r9gp,Heather Camel Pique Crew Sweater,Knit Sweaters,0,0,0,2023-11-01
p_349fd5fte5,Black Crew Neck Sweater,Knit Sweaters,0,0,0,2023-11-01
p_geubz42rmh,Heather Oatmeal Crew Neck Sweater,Knit Sweaters,0,0,0,2023-11-01
p_mm5tbn6qza,Black Active Comfort Crew Sweatshirt,Sweatshirt,0,0,0,2023-11-01
p_mkhh2ymk98,Heather Navy Active Comfort Crew Sweatshirt,Sweatshirt,0,0,0,2023-11-01
p_av6ja2w28x,Charcoal Heather Active Comfort Crew Sweatshirt,Athletic Tops,0,0,0,2023-11-01
p_w99wqwtmd8,Black Quarter Zip Performance Shirt,Athletic Tops,0,0,0,2023-11-01
p_kyd5cmqetn,Heather Navy Quarter Zip Performance Shirt,Athletic Tops,0,0,0,2023-11-01
p_cpfjz5js6m,Light Heather Gray Quarter Zip Performance Shirt,Athletic Tops,0,0,0,2023-11-01
p_bxpjzp3q34,Black Sweater Hoodie,Hoodie,0,0,0,2023-11-01
p_d53wqyy6nw,Oatmeal Sweater Hoodie,Hoodie,0,0,0,2023-11-01
p_gvy838kdy9,Black and Carbon Sweater Button Up Shirt,Shirt,0,0,0,2023-11-01
p_xzqapfsfbt,Heather Navy Sweater Button Up Shirt,Button Down Shirts,0,0,0,2023-11-01
p_j23j35syzx,Black Wash Long Sleeve Chambray Shirt,Shirt,0,0,0,2023-11-01
p_yduenc8dn4,Medium Indigo Wash Long Sleeve Chambray Shirt,Shirt,0,0,0,2023-11-01
p_8kszhsuzjs,Light Indigo Wash Long Sleeve Chambray Shirt,Shirt,0,0,0,2023-11-01
p_wrcbv4f2uu,Navy Hooded Long Sleeve T-Shirt,Sweatshirt,0,0,0,2023-11-01
p_jgj485u9gx,Heather Gray Hooded Long Sleeve T-Shirt,Hoodie,0,0,0,2023-11-01
p_fx25mpavbf,Black Hooded Long Sleeve T-Shirt,Shirt,0,0,0,2023-11-01
p_3h5wxbdgfn,White Long Sleeve Polo,Polos,0,0,0,2023-11-01
p_bsqvpked3y,Heather Gray Long Sleeve Polo,Polos,0,0,0,2023-11-01
p_gawdf2gbfa,Black Long Sleeve Polo,Polos,0,0,0,2023-11-01
p_vjd833ph3z,White Waffle Hoodie,Hoodie,0,0,0,2023-11-01
p_3rcm54jqbs,Navy Waffle Hoodie,Hoodie,0,0,0,2023-11-01
p_qh5ucmcku5,Military Green Waffle Hoodie,Hoodie,0,0,0,2023-11-01
p_5uvd4uv28m,Mahogany Waffle Hoodie,Hoodie,0,0,0,2023-11-01
p_44y3pv4s9m,Heather Gray Waffle Hoodie,Hoodie,0,0,0,2023-11-01
p_yev838e3bk,Dark Olive Waffle Hoodie,Hoodie,0,0,0,2023-11-01
p_ernxztwztw,Dark Oak Waffle Hoodie,Hoodie,0,0,0,2023-11-01
p_w7fjxgtxrq,Carbon Waffle Hoodie,Hoodie,0,0,0,2023-11-01
p_xafkdxwnvm,Black Waffle Hoodie,Hoodie,0,0,0,2023-11-01
p_vp3anzz9s3,White Button Up Shirt,Button Down Shirts,0,0,0,2023-11-01
p_4ssfur9upr,Pale Blue Button Up Shirt,Button Down Shirts,0,0,0,2023-11-01
p_8te7cjyvhe,Navy Long Sleeve Button Up Shirt,Shirt,0,0,0,2023-11-01
p_5pqpzmazbr,Carbon Long Sleeve Button Up Shirt,Shirt,0,0,0,2023-11-01
p_g5xjgypbqs,Black Long Sleeve Button Up Shirt,Button Down Shirts,0,0,0,2023-11-01
p_5uapency29,Navy Waffle Long Sleeve Crew Neck,Sweatshirt,0,0,0,2023-11-01
p_anqd83cjye,Military Green Waffle Long Sleeve Crew Neck,Sweatshirt,0,0,0,2023-11-01
p_yvh727338v,Mahogany Long Sleeve Waffle Crew,Sweatshirt,0,0,0,2023-11-01
p_u7w9858j24,Evergreen Heather Long Sleeve Waffle Crew,Shirt,0,0,0,2023-11-01
p_suvp62harc,Deep Sea Blue Long Sleeve Waffle Crew,Shirt,0,0,0,2023-11-01
p_8a76bz75kt,Dark Olive Long Sleeve Waffle Crew,Shirt,0,0,0,2023-11-01
p_jamakv65c4,Dark Oak Long Sleeve Waffle Crew,Shirt,0,0,0,2023-11-01
p_pqjyybc86f,Black Waffle Long Sleeve Crew Neck,Sweatshirt,0,0,0,2023-11-01
p_92vf4hpdrt,White Commuter Short Sleeve Button Up,Button Down Shirts,0,0,0,2023-11-01
p_v5bwyyhget,Carbon Commuter Short Sleeve Button Up,Button Down Shirts,0,0,0,2023-11-01
p_85skykpy7r,Black Commuter Short Sleeve Button Up,Button Down Shirts,0,0,0,2023-11-01
p_b6eyjdbtjf,Heather Navy Short Sleeve Loungewear Tee,T-Shirts,0,0,0,2023-11-01
p_5kr9enrf6j,Charcoal Heather Gray Short Sleeve Loungewear Tee,T-Shirts,0,0,0,2023-11-01
p_mnk33hmpwg,White Short Sleeve Active Polo,Polos,0,0,0,2023-11-01
p_5amw7y2f77,Navy Short Sleeve Active Polo,Polos,0,0,0,2023-11-01
p_xwuyuu3rrp,Heather Forest Active Polo,Polos,0,0,0,2023-11-01
p_8pczdfc69m,Heather Cocoa Active Polo,Polos,0,0,0,2023-11-01
p_vnexp6dh3m,Heather Centurion Active Polo,Polos,0,0,0,2023-11-01
p_gwz4ntvv3h,Dark Heather Tempest Active Polo,Polos,0,0,0,2023-11-01
p_8tryb2ahrp,Dark Heather Cocoa Active Polo,Polos,0,0,0,2023-11-01
p_rpwqburrmc,Dark Heather Cadet Active Polo,Polos,0,0,0,2023-11-01
p_u9t2zm725p,Black Short Sleeve Active Polo,Polos,0,0,0,2023-11-01
p_krqrvpb5nk,Black Short Sleeve Sweater Polo,Polos,0,0,0,2023-11-01
p_rdac8nxqpc,Navy Short Sleeve Sweater Polo,Polos,0,0,0,2023-11-01
p_zfqbnz8zdc,Heather Gray Short Sleeve Sweater Polo,Polos,0,0,0,2023-11-01
p_bpux6v6hy3,Moss Short Sleeve Sweater Polo,T-Shirts,0,0,0,2023-11-01
p_ezjsg82fk7,Garnet Short Sleeve Sweater Polo,Polos,0,0,0,2023-11-01
p_c9ns4c76gj,Centurion Short Sleeve Sweater Polo,Polos,0,0,0,2023-11-01
p_xdyq8mewrc,Black Short Sleeve Button Up Shirt,Shirt,0,0,0,2023-11-01
p_56qjzafa6s,Carbon Short Sleeve Button Up Shirt,Shirt,0,0,0,2023-11-01
p_5crt48k7v7,Navy Short Sleeve Button Up Shirt,Shirt,0,0,0,2023-11-01
p_r6t642amsw,White Short Sleeve Button Up Shirt,Shirt,0,0,0,2023-11-01
p_2884tbvwge,Black Sweater Scarf,Scarf,0,0,0,2023-11-01
p_ch7bwuavhv,Heather Gray Sweater Scarf,Scarf,0,0,0,2023-11-01
p_khf4jedvbb,Evergreen Sweater Scarf,Scarf,0,0,0,2023-11-01
p_hj4kerceu3,Heather Gray Sweater Beanie,Beanie,0,0,0,2023-11-01
p_h644hfsgj7,Black Sweater Beanie,Beanie,0,0,0,2023-11-01
p_fcgghnz6fh,Evergreen Sweater Beanie,Beanie,0,0,0,2023-11-01
p_ngty2gftav,White Active Never Show Socks 3-Pack,Socks,0,0,0,2023-11-01
p_rsv9ad7zfm,Black Active Never Show Socks 3-Pack,Socks,0,0,0,2023-11-01
p_g3gspfy9gd,Heather Gray Active Never Show Socks 3-Pack,Socks,0,0,0,2023-11-01
p_ujh7mwvk9j,White Active Ankle Socks 3-Pack,Socks,0,0,0,2023-11-01
p_tpv8fcqeja,Heather Gray Active Ankle Socks 3-Pack,Socks,0,0,0,2023-11-01
p_pds624ht98,Black Active Ankle Socks 3-Pack,Socks,0,0,0,2023-11-01
p_n52bwwvypc,White Active Crew Socks 3-Pack,Socks,0,0,0,2023-11-01
p_5dcwr4hn95,Heather Gray Active Crew Socks 3-Pack,Socks,0,0,0,2023-11-01
p_h9thpv33ux,Black Active Crew Socks 3-Pack,Socks,0,0,0,2023-11-01
p_m5nrytn7g3,Black Logo Boxer Briefs 3-Pack,Underwear,0,0,0,2023-11-01
p_yefeaupknw,White Never Show Socks 3-Pack,Socks,0,0,0,2023-11-01
p_wuqcj8q3tb,Heather Gray Never Show Socks 3-Pack,Socks,0,0,0,2023-11-01
p_3t9x6drd9q,Black Never Socks 3-Pack,Socks,0,0,0,2023-11-01
p_x285vx432e,White Ankle Socks 3-Pack,Socks,0,0,0,2023-11-01
p_nrvcex92tr,Heather Gray Ankle Socks 3-Pack,Socks,0,0,0,2023-11-01
p_vm4udwbmec,Black Ankle Socks 3-Pack,Socks,0,0,0,2023-11-01
p_kdjpvxj7fs,White Half Crew Sock 3-Pack,Socks,0,0,0,2023-11-01
p_y6cg76w8k6,Heather Gray Half Crew Sock 3-Pack,Socks,0,0,0,2023-11-01
p_eg72spursx,Black Half Crew Sock 3-Pack,Socks,0,0,0,2023-11-01
p_vvxrx4e62u,Navy Boxer Trunks 3-Pack,Underwear,0,0,0,2023-11-01
p_rd96dkwsx6,Carbon Boxer Trunks 3-Pack,Underwear,0,0,0,2023-11-01
p_hv5d9t5gb4,Black Boxer Trunks 3-Pack,Underwear,0,0,0,2023-11-01
p_39acmqrp48,White Never Show Socks 3-Pack,Socks,0,0,0,2023-11-01
p_2upyr9bv7v,Heather Gray Never Show Socks 3-Pack,Socks,0,0,0,2023-11-01
p_7rzxq9sd8n,Black Never Show Socks 3-Pack,Socks,0,0,0,2023-11-01
p_ebtxk5mjkc,Teal Boxer Briefs 3-Pack,Underwear,0,0,0,2023-11-01
p_hcstkqf7xs,Navy Boxer Briefs 3-Pack,Underwear,0,0,0,2023-11-01
p_gky7ujn5kk,Military Green Boxer Briefs 3-Pack,Underwear,0,0,0,2023-11-01
p_zkfhub8juv,Indigo Boxer Briefs 3-Pack,Underwear,0,0,0,2023-11-01
p_9u87cuwg9k,Carbon Boxer Briefs 3-Pack,Underwear,0,0,0,2023-11-01
p_k8j2vzha5p,Burgundy Boxer Briefs 3-Pack,Underwear,0,0,0,2023-11-01
p_55tcz9qg6f,Black Boxer Briefs 3-Pack,Underwear,0,0,0,2023-11-01
p_vxfj55w6ma,Heather Burgundy Polo,Polos,0,0,0,2023-11-01
p_sgut9a5tns,Light Heather Gray Polo,Polos,0,0,0,2023-11-01
p_r5xrp6kuxu,True Red Polo,Polos,0,0,0,2023-11-01
p_tsfkh7tn7s,Electric Blue Polo,Polos,0,0,0,2023-11-01
p_ekn749wjq2,Periwinkle Blue Polo,Polos,0,0,0,2023-11-01
p_ntuxn2s2c5,Yellow Polo,Polos,0,0,0,2023-11-01
p_nptyvkznma,Raspberry Polo,Polos,0,0,0,2023-11-01
p_5fx952fk68,Mahogany Polo,Polos,0,0,0,2023-11-01
p_3zf2yh34hr,Dark Olive Polo,Polos,0,0,0,2023-11-01
p_vqc6jejd69,Black Do-It-All Comfort Button Up Shirt,Button Down Shirts,0,0,0,2023-11-01
p_j9huduq2g2,White Tall Straight Hem Crew Neck T-Shirt,T-Shirts,0,0,0,2023-11-01
p_mxpb4sqvry,Charcoal Heather Gray Short Sleeve Tall Crew,Screen Printed T-Shirts,0,0,0,2023-11-01
p_3xnj548f3x,Sapphire Short Sleeve Tall Crew,T-Shirts,0,0,0,2023-11-01
p_qdyz4je3zm,Heather Navy Short Sleeve Tall Crew,Screen Printed T-Shirts,0,0,0,2023-11-01
p_6dheg7pqst,Heather Military Green Short Sleeve Tall Crew,Screen Printed T-Shirts,0,0,0,2023-11-01
p_92fw37ajex,Heather Seafarer Short Sleeve Tall Crew,Shirt,0,0,0,2023-11-01
p_rhk5rdjr7y,Heather Voyager Short Sleeve Tall Crew,Screen Printed T-Shirts,0,0,0,2023-11-01
p_hz3svpszdm,Military Green Tall Long Sleeve T-Shirt,Shirt,0,0,0,2023-11-01
p_3aup7bbqg3,Carbon Tall Long Sleeve T-Shirt,Shirt,0,0,0,2023-11-01
p_9w9zuxyz4u,Heather Gray Tall Long Sleeve T-Shirt,Shirt,0,0,0,2023-11-01
p_awt8ehv6fc,Heather Gray Short Sleeve Tall Polo,Polos,0,0,0,2023-11-01
p_26x46r3gh3,Carbon Short Sleeve Tall Polo,Polos,0,0,0,2023-11-01
p_487dnzupxz,Military Green Short Sleeve Tall Polo,Polos,0,0,0,2023-11-01
p_4tr7py5djr,Heather Military Green Short Sleeve Tall Polo,Polos,0,0,0,2023-11-01
p_uwgqdnnawm,Charcoal Heather Gray Short Sleeve Tall Polo,Polos,0,0,0,2023-11-01
p_haens7aj79,Sapphire Short Sleeve Tall Polo,Polos,0,0,0,2023-11-01
p_zj7jup4nyu,Heather Navy Short Sleeve Tall Polo,Polos,0,0,0,2023-11-01
p_7kfvh4xezv,Heather Cayenne Short Sleeve Tall Polo,Polos,0,0,0,2023-11-01
p_nwupg26v6n,Heather Seafarer Short Sleeve Tall Polo,Polos,0,0,0,2023-11-01
p_3xfh7nu9bh,Dark Oak Fleece French Terry Zip Hoodie,Hoodie,0,0,0,2023-11-01
p_3hycs4vyy4,Mahogany Fleece French Terry Zip Hoodie,Hoodie,0,0,0,2023-11-01
p_f6kya6hhfz,Charcoal Heather Gray Fleece French Terry Full Zip,Hoodie,0,0,0,2023-11-01
p_qxh7485yuh,Dark Oak Fleece French Terry Pullover Hoodie,Hoodie,0,0,0,2023-11-01
p_ug78456eub,Mahogany Fleece French Terry Pullover Hoodie,Hoodie,0,0,0,2023-11-01
p_ct8bqyz5rd,Black Bomber Jacket,Bomber Jackets,0,0,0,2023-11-01
p_qvxdc36tay,Carbon Bomber Jacket,Bomber Jackets,0,0,0,2023-11-01
p_6svhrtmsn3,Navy Bomber Jacket,Bomber Jackets,0,0,0,2023-11-01
p_n7npmmnfq3,Army Green Bomber Jacket,Bomber Jackets,0,0,0,2023-11-01
p_vhct7fnamt,Black Sweater Fleece Jacket,Jacket,0,0,0,2023-11-01
p_ubarpzrdvd,Gray Sweater Fleece Jacket,Knit Sweaters,0,0,0,2023-11-01
p_e6pz5d7uh9,Navy Sweater Fleece Jacket,Hoodie,0,0,0,2023-11-01
p_xqd85rvpxs,Black Puffer Jacket,Puffer Jackets,0,0,0,2023-11-01
p_25m5nqdhtq,Gunmetal Puffer Jacket,Puffer Jackets,0,0,0,2023-11-01
p_4yh4m8q3v7,Navy Puffer Jacket,Puffer Jackets,0,0,0,2023-11-01
p_9nq4jjbkbr,Military Green Puffer Jacket,Puffer Jackets,0,0,0,2023-11-01
p_dwbw45rvge,Navy Hooded Puffer Jacket,Puffer Jackets,0,0,0,2023-11-01
p_yqusyfjxtf,Gunmetal Hooded Puffer Jacket,Puffer Jackets,0,0,0,2023-11-01
p_4xmfcxsvq4,Black Hooded Puffer Jacket,Puffer Jackets,0,0,0,2023-11-01
p_y5u5gs4evr,Navy Straight Twill Chino,Pants,0,0,0,2023-11-01
p_sd5n4w6efe,Meadow Straight Twill Chino,Pants,0,0,0,2023-11-01
p_2w7q49pfad,Khaki Straight Twill Chino,Pants,0,0,0,2023-11-01
p_ja9tudbs9q,Dark Oak Straight Twill Chino,Pants,0,0,0,2023-11-01
p_zd6gtes7qp,Centurion Straight Twill Chino,Pants,0,0,0,2023-11-01
p_zrt8e4hahp,Black Straight Twill Chino,Pants,0,0,0,2023-11-01
p_rnmhwn9kcu,Navy Slim Twill Chino,Pants,0,0,0,2023-11-01
p_kkdff6r47e,Meadow Slim Twill Chino,Pants,0,0,0,2023-11-01
p_xssegyneze,Khaki Slim Twill Chino,Pants,0,0,0,2023-11-01
p_gawvtrdjqd,Dark Oak Slim Twill Chino,Pants,0,0,0,2023-11-01
p_6bppe3h2jj,Centurion Slim Twill Chino,Pants,0,0,0,2023-11-01
p_kryxw7cx9g,Black Slim Twill Chino,Pants,0,0,0,2023-11-01
p_adhb2jnwk7,Military Green Tall Straight Hem Crew Neck T-Shirt,Screen Printed T-Shirts,0,0,0,2023-12-01
p_uwm4psyppk,Black Tall Straight Hem Crew Neck T-Shirt,T-Shirts,0,0,0,2023-12-01
p_mwv4sjthwt,Military Green Polo,Polos,0,0,0,2023-12-01
p_3dh3myqfyq,Charcoal Heather Gray Polo,Polos,0,0,0,2023-12-01
p_bhfd33ejhy,Indigo Polo,Polos,0,0,0,2023-12-01
p_k45z3pw892,Heather Military Green Polo,Polos,0,0,0,2023-12-01
p_s6hq3cbp99,Heather Indigo Polo,Polos,0,0,0,2023-12-01
p_rcg6tt8ugv,Heather Navy Polo,Polos,0,0,0,2023-12-01
p_6hvvy94kq4,White Polo,Polos,0,0,0,2023-12-01
p_rhexhysfzs,Navy Polo,Polos,0,0,0,2023-12-01
p_5rc5ezqwny,Heather Gray Polo,Polos,0,0,0,2023-12-01
p_gf9pckvcm8,Carbon Polo,Polos,0,0,0,2023-12-01
p_v9vmgr3m4t,Black Polo,Polos,0,0,0,2023-12-01
p_m6x758mjvq,White Tall Polo Shirt,Polos,0,0,0,2023-12-01
p_xa4dn5yc22,Navy Tall Polo Shirt,Polos,0,0,0,2023-12-01
p_d53y9qe93b,Black Tall Polo Shirt,Polos,0,0,0,2023-12-01
p_g32ada7z2e,Heather Military Green V-Neck T-Shirt,Shirt,0,0,0,2023-12-01
p_4jt8bhmzh4,Heather Indigo V-Neck T-Shirt,Shirt,0,0,0,2023-12-01
p_tmft42amrv,Heather Navy V-Neck T-Shirt,Shirt,0,0,0,2023-12-01
p_xkytap8cnw,Indigo V-Neck,Shirt,0,0,0,2023-12-01
p_yjazyejt4q,Charcoal Heather Gray V-Neck,Shirt,0,0,0,2023-12-01
p_dgyvxnvaz7,Heather Gray V-Neck T-Shirt,Screen Printed T-Shirts,0,0,0,2023-12-01
p_7szwc3brf5,Military Green V-Neck T-Shirt,T-Shirts,0,0,0,2023-12-01
p_f4b57xp8t5,Carbon V-Neck T-Shirt,Screen Printed T-Shirts,0,0,0,2023-12-01
p_2wu3jtehp2,Navy V-Neck T-Shirt,Shirt,0,0,0,2023-12-01
p_s49r5jxnqq,White V-Neck T-Shirt,T-Shirts,0,0,0,2023-12-01
p_s7yfamyjwt,Black V-Neck T-Shirt,Screen Printed T-Shirts,0,0,0,2023-12-01
p_955cnseek9,Light Heather Gray Crew Neck Long Sleeve,Sweatshirt,0,0,0,2023-12-01
p_p7f2zhnqyr,Heather Military Green Long Sleeve Crew T-Shirt,Shirt,0,0,0,2023-12-01
p_4fs9u74y4x,Heather Indigo Crew Neck Long Sleeve,Sweatshirt,0,0,0,2023-12-01
p_ccse4psnan,Heather Navy Crew Neck Long Sleeve,Sweatshirt,0,0,0,2023-12-01
p_jtvvyfaspc,Indigo Long Sleeve,Shirt,0,0,0,2023-12-01
p_9744mpdv5n,Charcoal Heather Gray Long Sleeve,Shirt,0,0,0,2023-12-01
p_6zjn28jf23,Military Green Crew Neck Long Sleeve,Shirt,0,0,0,2023-12-01
p_rgamhxuwjz,Carbon Crew Neck Long Sleeve,Shirt,0,0,0,2023-12-01
p_2cus7843n6,White Crew Neck Long Sleeve,Shirt,0,0,0,2023-12-01
p_tjh5t8a6tw,Navy Crew Neck Long Sleeve,Shirt,0,0,0,2023-12-01
p_ea2gekbzfm,Heather Gray Crew Neck Long Sleeve,T-Shirts,0,0,0,2023-12-01
p_2gwdmudpww,Black Crew Neck Long Sleeve,Shirt,0,0,0,2023-12-01
p_twpefb4vpq,White Long Sleeve Henley,T-Shirts,0,0,0,2023-12-01
p_brwwn6xkwh,Military Green Long Sleeve Henley,T-Shirts,0,0,0,2023-12-01
p_vrmxbznmh9,Indigo Long Sleeve Henley,Shirt,0,0,0,2023-12-01
p_ddgsdeyzu9,Heather Gray Long Sleeve Henley,T-Shirts,0,0,0,2023-12-01
p_prm2runmas,Carbon Long Sleeve Henley,T-Shirts,0,0,0,2023-12-01
p_ngbbqfwzd5,Navy Long Sleeve Henley,Shirt,0,0,0,2023-12-01
p_d47n8u8fab,Black Long Sleeve Henley,Shirt,0,0,0,2023-12-01
p_f9pnrt5gxg,White Tall Long Sleeve T-Shirt,Shirt,0,0,0,2023-12-01
p_gwrcu4nmwy,Navy Tall Long Sleeve T-Shirt,Shirt,0,0,0,2023-12-01
p_r8knzgkx6e,Black Tall Long Sleeve T-Shirt,Shirt,0,0,0,2023-12-01
p_htnnbrvvmk,Carbon Active Crew Neck,T-Shirts,0,0,0,2023-12-01
p_fhu7chaef6,Military Green Active Crew Neck,Shirt,0,0,0,2023-12-01
p_vtkmnr87v2,Navy Active Crew Neck T-Shirt,T-Shirts,0,0,0,2023-12-01
p_g2qrwgfcz3,Charcoal Heather Gray Active Crew Neck T-Shirt,Athletic Tops,0,0,0,2023-12-01
p_8rbvhb5tdc,White Active Crew Neck T-Shirt,Shirt,0,0,0,2023-12-01
p_shhxbvvxxp,Heather Indigo Active Crew Neck T-Shirt,Screen Printed T-Shirts,0,0,0,2023-12-01
p_ggx5q9x8xm,Heather Military Green Active Crew Neck T-Shirt,Shirt,0,0,0,2023-12-01
p_95axe6dfn6,Heather Navy Active Crew Neck T-Shirt,Screen Printed T-Shirts,0,0,0,2023-12-01
p_wj3u3m87yx,Black Active Crew Neck T-Shirt,T-Shirts,0,0,0,2023-12-01
p_u7qsd3tvvz,Carbon Tall Active Crew Neck,Athletic Tops,0,0,0,2023-12-01
p_q4vc2txt5x,Black Tall Active Crew Neck,Shirt,0,0,0,2023-12-01
p_eun7gkcf5q,Navy Tall Active Crew Neck,Shirt,0,0,0,2023-12-01
p_bptwztkuks,Navy Active Polo,Polos,0,0,0,2023-12-01
p_73vqwcfbpf,Charcoal Heather Gray Active Polo,Polos,0,0,0,2023-12-01
p_4xegh3d2dq,White Active Polo,Polos,0,0,0,2023-12-01
p_pzg4uy9ru4,Heather Military Green Active Polo,Polos,0,0,0,2023-12-01
p_2ht5q2fn8k,Heather Navy Active Polo,Polos,0,0,0,2023-12-01
p_vjfh4zw9pd,Black Active Polo,Polos,0,0,0,2023-12-01
p_xngupz8qg8,Heather Military Green Active Long Sleeve Crew Neck,T-Shirts,0,0,0,2023-12-01
p_ujs2rxbwwy,Charcoal Heather Gray Active Long Sleeve Crew Neck,T-Shirts,0,0,0,2023-12-01
p_tpzfdnukzs,Navy Active Long Sleeve Crew Neck,Sweatshirt,0,0,0,2023-12-01
p_5q6tnqwruf,Heather Light Gray Active Long Sleeve Crew Neck,Sweatshirt,0,0,0,2023-12-01
p_r5gttk27sm,White Active Long Sleeve Crew Neck,Shirt,0,0,0,2023-12-01
p_5kpddtqty2,Heather Navy Active Long Sleeve Crew Neck,Sweatshirt,0,0,0,2023-12-01
